<?xml version="1.0" encoding="UTF-8"?>
<?xml-stylesheet type="text/xsl" href="xsl_mathml.xsl"?>
<!DOCTYPE mathml SYSTEM "dtd_mathml.dtd">

<mathml xsi:schemaLocation="xsd_mathml.xsd">>
   <types>
      <expression_type name="function" id="F" />
      <expression_type name="integral" id="I" />
      <expression_type name="equation" id="E" />
      <expression_type name="matrix" id="M" />
      <expression_type name="determinant" id="D" />
   </types>
   <math_expressions>
      <expression expression_id="F">
         <math xmlns="http://www.w3.org/1998/Math/MathML">
            <mspace linebreak="newline" />
            <mrow>
               <msup>
                  <mi>x</mi>
                  <mn>4</mn>
               </msup>
            </mrow>
         </math>
      </expression>
      <expression expression_id="F">
         <math xmlns="http://www.w3.org/1998/Math/MathML">
            <mspace linebreak="newline" />
            <mrow>
               <mi>y</mi>
               <mo>=</mo>
               <mroot>
                  <msup>
                     <mi>x</mi>
                     <mn>2</mn>
                  </msup>
                  <mn>3</mn>
               </mroot>
            </mrow>
         </math>
      </expression>
      <expression expression_id="F">
         <math xmlns="http://www.w3.org/1998/Math/MathML">
            <mspace linebreak="newline" />
            <mrow>
               <mi>cos</mi>
               <mo>(</mo>
               <msup>
                  <mi>x</mi>
                  <mn>2</mn>
               </msup>
               <mo>)</mo>
            </mrow>
         </math>
      </expression>
      <expression expression_id="F">
         <math xmlns="http://www.w3.org/1998/Math/MathML">
            <mspace linebreak="newline" />
            <mrow>
               <mrow>
                  <munderover>
                     <mo>∑</mo>
                     <mrow>
                        <mi>i</mi>
                        <mo>=</mo>
                        <mn>0</mn>
                     </mrow>
                     <mi>p</mi>
                  </munderover>
               </mrow>
               <msup>
                  <mi>i</mi>
                  <mn>4</mn>
               </msup>
               <mo>=</mo>
               <msup>
                  <mrow>
                     <mo>(</mo>
                     <mfrac>
                        <mrow>
                           <mi>p</mi>
                           <mrow>
                              <mo>(</mo>
                              <mi>p</mi>
                              <mo>+</mo>
                              <mn>1</mn>
                              <mo>)</mo>
                           </mrow>
                        </mrow>
                        <mn>4</mn>
                     </mfrac>
                     <mo>)</mo>
                  </mrow>
                  <mn>2</mn>
               </msup>
            </mrow>
         </math>
      </expression>
      <expression expression_id="F">
         <math xmlns="http://www.w3.org/1998/Math/MathML">
            <mspace linebreak="newline" />
            <mrow>
               <mfrac>
                  <mrow>
                     <mn>1</mn>
                  </mrow>
                  <mrow>
                     <msup>
                        <mi>e</mi>
                        <mrow>
                           <mi>a</mi>
                           <mi>x</mi>
                        </mrow>
                     </msup>
                  </mrow>
               </mfrac>
            </mrow>
         </math>
      </expression>
      <expression expression_id="F">
         <math xmlns="http://www.w3.org/1998/Math/MathML">
            <mspace linebreak="newline" />
            <mrow>
               <munderover>
                  <mo>∑</mo>
                  <mrow>
                     <mi>m</mi>
                     <mo>=</mo>
                     <mn>1</mn>
                  </mrow>
                  <mn>3</mn>
               </munderover>
               <mrow>
                  <munderover>
                     <mo>∑</mo>
                     <mrow>
                        <mi>n</mi>
                        <mo>=</mo>
                        <mn>1</mn>
                     </mrow>
                     <mi>m</mi>
                  </munderover>
                  <mrow>
                     <mi>sin</mi>
                     <mo>[</mo>
                     <mrow>
                        <msup>
                           <mi>x</mi>
                           <mi>m</mi>
                        </msup>
                        <mo>+</mo>
                        <msup>
                           <mi>y</mi>
                           <mi>n</mi>
                        </msup>
                     </mrow>
                     <mo>]</mo>
                  </mrow>
               </mrow>
            </mrow>
         </math>
      </expression>
      <expression expression_id="E">
         <math xmlns="http://www.w3.org/1998/Math/MathML">
            <mspace linebreak="newline" />
            <mrow>
               <mi>x</mi>
               <mo>=</mo>
               <mfrac>
                  <mrow>
                     <mrow>
                        <mo>-</mo>
                        <mi>b</mi>
                     </mrow>
                     <mo>±</mo>
                     <msqrt>
                        <mrow>
                           <msup>
                              <mi>b</mi>
                              <mn>2</mn>
                           </msup>
                           <mo>-</mo>
                           <mrow>
                              <mn>4</mn>
                              <mo>⁢</mo>
                              <mi>a</mi>
                              <mo>⁢</mo>
                              <mi>c</mi>
                           </mrow>
                        </mrow>
                     </msqrt>
                  </mrow>
                  <mrow>
                     <mn>2</mn>
                     <mo>⁢</mo>
                     <mi>a</mi>
                  </mrow>
               </mfrac>
            </mrow>
         </math>
      </expression>
      <expression expression_id="I">
         <math xmlns="http://www.w3.org/1998/Math/MathML">
            <mspace linebreak="newline" />
            <mrow>
               <mo>∫</mo>
               <mfenced separators="">
                  <mn>5</mn>
                  <mi>x</mi>
                  <mo>+</mo>
                  <mn>2</mn>
                  <mi>sin</mi>
                  <mfenced separators="">
                     <mi>x</mi>
                  </mfenced>
               </mfenced>
               <mi>dx</mi>
            </mrow>
         </math>
      </expression>
      <expression expression_id="I">
         <math xmlns="http://www.w3.org/1998/Math/MathML">
            <mspace linebreak="newline" />
            <mrow>
               <munderover>
                  <mo>∫</mo>
                  <mi>a</mi>
                  <mi>b</mi>
               </munderover>
               <mfenced separators="">
                  <mn>5</mn>
                  <mi>x</mi>
                  <mo>+</mo>
                  <mn>2</mn>
                  <mi>sin</mi>
                  <mfenced separators="">
                     <mi>x</mi>
                  </mfenced>
               </mfenced>
               <mi>dx</mi>
            </mrow>
         </math>
      </expression>
      <expression expression_id="M">
         <math xmlns="http://www.w3.org/1998/Math/MathML">
            <mspace linebreak="newline" />
            <mrow>
               <mfenced>
                  <mtable>
                     <mtr>
                        <mtd>
                           <mn>1</mn>
                        </mtd>
                        <mtd>
                           <mn>0</mn>
                        </mtd>
                        <mtd>
                           <mn>0</mn>
                        </mtd>
                     </mtr>
                     <mtr>
                        <mtd>
                           <mn>0</mn>
                        </mtd>
                        <mtd>
                           <mn>1</mn>
                        </mtd>
                        <mtd>
                           <mn>0</mn>
                        </mtd>
                     </mtr>
                     <mtr>
                        <mtd>
                           <mn>0</mn>
                        </mtd>
                        <mtd>
                           <mn>0</mn>
                        </mtd>
                        <mtd>
                           <mn>1</mn>
                        </mtd>
                     </mtr>
                  </mtable>
               </mfenced>
            </mrow>
         </math>
      </expression>
      <expression expression_id="D">
         <math xmlns="http://www.w3.org/1998/Math/MathML">
            <mspace linebreak="newline" />
            <mrow>
               <mi>det A</mi>
               <mo>=</mo>
               <mfenced open="|" close="|">
                  <mtable>
                     <mtr>
                        <mtd>
                           <msub>
                              <mi>a</mi>
                              <mrow>
                                 <mn>1</mn>
                                 <mn>1</mn>
                              </mrow>
                           </msub>
                        </mtd>
                        <mtd>
                           <msub>
                              <mi>a</mi>
                              <mrow>